{
  "$schema": "https://json-schema.org/draft/2020-12/schema",
  "$id": "pantheon/molekuel/1",
  "title": "Molekül (Ziel-Baustein) mit Umsetzungen",
  "description": "Ein Molekül ist ein Spielziel aus dem Baukasten (z. B. 'Signal orten'). Umsetzungen sind konkrete, getestete Regiebuch-Vorlagen dafür. Ein Molekül ist verfügbar, sobald eine Umsetzung verfügbar ist (alle Mechaniken in 'braucht' verfügbar, Vorlage besteht den Prüfer).",
  "type": "object",
  "additionalProperties": false,
  "required": [
    "format",
    "id",
    "name",
    "familie",
    "kern",
    "ansaetze",
    "szenentypen",
    "umsetzungen"
  ],
  "properties": {
    "$schema": {
      "type": "string"
    },
    "format": {
      "const": "molekuel/1"
    },
    "id": {
      "type": "string",
      "pattern": "^[a-z][a-z0-9_]*$"
    },
    "erweitert": {
      "type": "boolean",
      "description": "Mod: fügt einem bestehenden Molekül gleicher ID Umsetzungen hinzu, statt es neu zu definieren"
    },
    "name": {
      "type": "string",
      "maxLength": 40
    },
    "familie": {
      "type": "string"
    },
    "kern": {
      "type": "string",
      "maxLength": 200,
      "description": "Was es ist, in einem Satz – für Spielleiter und Menschen"
    },
    "ansaetze": {
      "type": "array",
      "items": {
        "enum": [
          "gewalt",
          "heimlich",
          "reden",
          "technik"
        ]
      }
    },
    "szenentypen": {
      "type": "array",
      "items": {
        "type": "string",
        "pattern": "^[ABCD][0-9]+$"
      }
    },
    "quelle": {
      "type": "string"
    },
    "umsetzungen": {
      "type": "array",
      "items": {
        "$ref": "#/$defs/umsetzung"
      }
    }
  },
  "$defs": {
    "umsetzung": {
      "type": "object",
      "additionalProperties": false,
      "required": [
        "id",
        "name",
        "beschreibung",
        "schauplatz",
        "braucht",
        "params",
        "dauer_min",
        "vorlage",
        "test"
      ],
      "properties": {
        "id": {
          "type": "string",
          "pattern": "^[a-z][a-z0-9_]*$"
        },
        "name": {
          "type": "string",
          "maxLength": 60
        },
        "beschreibung": {
          "type": "string",
          "maxLength": 500,
          "description": "Für den Spielleiter: wann passt es, wie fühlt es sich an, was müssen die Spieler tun"
        },
        "schauplatz": {
          "enum": [
            "weltraum",
            "aussen",
            "bord",
            "station"
          ]
        },
        "braucht": {
          "type": "array",
          "items": {
            "type": "string"
          },
          "description": "Mechaniken aus mechaniken.json"
        },
        "buehne_braucht": {
          "type": "object",
          "additionalProperties": false,
          "required": ["anker"],
          "description": "B1 (CONTRACT-B1 §11.1): was die gebaute Karte des Landepunkts haben muss; ersetzt params.map.werte. Der Szenenbau wählt den Landepunkt und setzt map ein (nie das LLM); Prüfung gegen die gebaute Karte (BUEHNE-ART, BUEHNE-ANKER, server/mission/objects.js pruefeBuehneBraucht).",
          "properties": {
            "kartenarten": { "type": "array", "items": { "enum": ["aussenposten", "station", "ruine", "schiff", "platform", "wreck", "kesh"] }, "description": "erlaubte Kartenarten bzw. Handkarten-IDs; fehlt = alle" },
            "anker": { "type": "array", "items": { "oneOf": [
              { "type": "string", "pattern": "^[a-z_]+$" },
              { "type": "object", "additionalProperties": false, "required": ["rolle"], "properties": { "rolle": { "type": "string", "pattern": "^[a-z_]+$" }, "paar": { "type": "integer", "minimum": 1 } } }
            ] }, "description": "Ankerrollen aus content/buehnen/anker.json; { rolle, paar: n } = n vollständige Paare" },
            "min": { "type": "object", "additionalProperties": { "type": "integer", "minimum": 1 }, "description": "Mindestzahl je Rolle, z. B. { eingang: 2 }" },
            "gefecht": { "type": "boolean", "description": "Karte braucht einen Gefechtsbereich" },
            "landepunkt": { "enum": ["laufzeit"], "description": "B1-FIX: Die Karte entsteht erst zur Laufzeit (z. B. kapern/prise_entern: <loc>.prise nach dem Raumgefecht) – der Szenenbau verlangt und wählt keinen Landepunkt; die Szene zählt trotzdem als Bodenszene. kartenarten/anker beschreiben die entstehende Karte." }
          }
        },
        "params": {
          "type": "object",
          "additionalProperties": {
            "type": "object",
            "additionalProperties": false,
            "required": [
              "typ"
            ],
            "properties": {
              "typ": {
                "enum": [
                  "loc",
                  "map",
                  "find",
                  "npc",
                  "squad",
                  "text",
                  "zahl",
                  "bool",
                  "aktionen",
                  "kind",
                  "anker",
                  "landepunkt"
                ]
              },
              "pflicht": {
                "type": "boolean"
              },
              "default": {},
              "werte": {
                "type": "array"
              },
              "min": {
                "type": "number"
              },
              "max": {
                "type": "number"
              },
              "beschreibung": {
                "type": "string"
              }
            }
          }
        },
        "dauer_min": {
          "type": "array",
          "items": {
            "type": "number"
          },
          "minItems": 2,
          "maxItems": 2
        },
        "dauer_quelle": {
          "enum": [
            "schaetzung",
            "gemessen"
          ],
          "description": "S2: Herkunft von dauer_min/dauer_je_crew – 'schaetzung' (von Hand) bis BOTS sie misst"
        },
        "dauer_je_crew": {
          "type": "object",
          "additionalProperties": false,
          "description": "S2: Dauer in Minuten [min, max] je Crewgröße (1–3)",
          "properties": {
            "1": { "type": "array", "items": { "type": "number" }, "minItems": 2, "maxItems": 2 },
            "2": { "type": "array", "items": { "type": "number" }, "minItems": 2, "maxItems": 2 },
            "3": { "type": "array", "items": { "type": "number" }, "minItems": 2, "maxItems": 2 }
          }
        },
        "liefert_flags": {
          "type": "array",
          "items": {
            "type": "string",
            "pattern": "^\\{\\{id\\}\\}_[a-z][a-z0-9_]*$"
          },
          "description": "S2: Flags (setFlag, persistent), die die Vorlage am Ende sicher setzt – für die Verzweigung des Spielleiters erlaubt (z. B. {{id}}_heil, {{id}}_beschaedigt, {{id}}_verloren)"
        },
        "rueckfall": {
          "type": "object",
          "additionalProperties": false,
          "required": [
            "params"
          ],
          "description": "S2: Parameter für die Rohfassung ohne LLM-Antwort. Ort/Karte kommen aus dem Grobplan (loc, map), npc-Parameter ggf. vom Auftraggeber; hier stehen neutrale Texte und Folgen für alle übrigen Pflichtparameter.",
          "properties": {
            "params": {
              "type": "object"
            }
          }
        },
        "sund_frei": {
          "type": "object",
          "additionalProperties": false,
          "required": ["beat", "belegt"],
          "description": "SUND-04b B2: die Umsetzung ist in der Freien Fahrt Sund spielbar, als Beat der Geschichtsfaeden (content/faeden/beats.json), ueber das Sim-Modul der Mechanik (nicht ueber den Labor-Pfad, der den Weltstand verfaelscht). beat = Beat-Typ, parameter = die Wahl des Plans (nur Werte aus bauplan.parameter.<name>.erlaubt), belegt = der Beleg (Test und Bot-Lauf). Nur Weltraum-Umsetzungen; Boden und Regiebuch gibt es dort nicht.",
          "properties": {
            "beat": { "type": "string", "pattern": "^[a-z][a-z0-9_]*$" },
            "parameter": { "type": "object", "additionalProperties": { "type": "string" } },
            "belegt": { "type": "string", "minLength": 8, "maxLength": 200 }
          }
        },
        "ereignisse": {
          "type": "array",
          "items": {
            "type": "string"
          },
          "description": "Ereignisse/Flags, an die Wendungen und Folgen anknüpfen können"
        },
        "vorlage": {
          "type": "object",
          "additionalProperties": false,
          "required": [
            "steps",
            "texte"
          ],
          "description": "Regiebuch-Fragment. Platzhalter: {{id}} (Instanz-Präfix), {{weiter}} (Folgeschritt), {{param}}. Ein String, der nur aus einem Platzhalter besteht, wird durch den Wert ersetzt (auch Zahlen, Listen).",
          "properties": {
            "buehne": {
              "type": "object"
            },
            "besetzung": {
              "type": "object"
            },
            "steps": {
              "type": "array",
              "minItems": 1
            },
            "on": {
              "type": "object"
            },
            "texte": {
              "type": "object"
            }
          }
        },
        "test": {
          "type": "object",
          "additionalProperties": false,
          "required": [
            "params"
          ],
          "description": "Testwerte: Der Lader setzt die Vorlage damit ein und prüft das Ergebnis mit tools/check-missions.js",
          "properties": {
            "params": {
              "type": "object"
            }
          }
        },
        "nach": {
          "type": "array",
          "items": {
            "type": "string",
            "pattern": "^[a-z][a-z0-9_]*/[a-z][a-z0-9_]*$"
          },
          "description": "Setzt voraus, dass diese Umsetzungen (molekül/umsetzung) vorher in der Mission vorkamen"
        }
      }
    }
  }
}